{
  "protocolVersion": "1.0.0",
  "host": {
    "name": "fake-host",
    "version": "1.0.0",
    "adapterVersion": "1.0.0"
  },
  "runId": "run-1",
  "sequence": 1,
  "timestamp": "2026-09-16T12:00:00Z",
  "type": "blocked",
  "data": {
    "result": {
      "schemaVersion": "1.0.0",
      "operation": {
        "state": "blocked",
        "reasons": [
          "runner unavailable"
        ]
      },
      "evaluation": {
        "applicable": true,
        "verdict": "inconclusive"
      },
      "evidence": {
        "applicable": true,
        "availability": "unavailable"
      },
      "approval": {
        "applicable": false,
        "state": "not-applicable"
      }
    },
    "error": {
      "code": "RUN_REQUEST_INVALID",
      "message": "Request is invalid.",
      "retryable": false
    }
  }
}
