{
  "protocolVersion": "1.0.0",
  "host": {
    "name": "fake-host",
    "version": "1.0.0",
    "adapterVersion": "1.0.0"
  },
  "runId": "run-1",
  "sequence": 1,
  "timestamp": "2026-09-16T12:00:00Z",
  "type": "completed",
  "data": {
    "result": {
      "schemaVersion": "1.0.0",
      "operation": {
        "state": "completed",
        "reasons": []
      },
      "evaluation": {
        "applicable": true,
        "verdict": "pass"
      },
      "evidence": {
        "applicable": true,
        "availability": "available"
      },
      "approval": {
        "applicable": true,
        "state": "pending",
        "context": "production-review"
      }
    }
  }
}
